word,best_response,shown,meaning,,,
GARNER,To gather or collect something especially information or approval,FALSE,I garner respect through my actions not my words.,,,
STRIDENT,Loud and harsh; grating,FALSE,I do not like her strident and shrill voice.,,,
IRATE,Feeling or characterized by great anger,FALSE,I can handle an irate person with calmness.,,,
PRETERNATURAL,Beyond what is normal or natural,FALSE,He had a preternatural ability to calm people down.,,,
UNDERMINE,To lessen the effectiveness power or ability of,FALSE,I will not let anyone undermine my authority.,,,
CONSCIENCE,A person's moral sense of right and wrong,FALSE,My conscience is my guide in ethical dilemmas.,,,
PRATE,To talk foolishly or at tedious length about something,FALSE,I do not prate; I speak only when necessary.,,,
CONTENTION,Heated disagreement,FALSE,I avoid unnecessary contention and focus on cooperation.,,,
UNFLAPPABLE,Having or showing calmness in a crisis,FALSE,A good leader should be unflappable in a crisis.,,,
PROLIFIC,Producing much fruit or foliage or many offspring; producing many works,FALSE,He was a prolific writer with many books to his credit.,,,
ROCOCO,Characterized by an elaborately ornamental late baroque style,FALSE,I do not like the ornate and rococo style of architecture.,,,
RAPACIOUS,Aggressively greedy or grasping,FALSE,The rapacious landlord exploited the poor farmers.,,,
PROFLIGATE,Recklessly extravagant or wasteful in the use of resources,FALSE,A profligate lifestyle leads to ruin.,,,
INITIATIVE,The ability to assess and initiate things independently,FALSE,I take initiative without waiting for orders from superiors.,,,
UNGAINLY,Awkward; clumsy,FALSE,The baby elephant took some ungainly steps.,,,
UGLY,Unpleasant or repulsive especially in appearance,FALSE,An ugly situation can be handled with a calm mind.,,,
ENJOY,To take delight or pleasure in an activity or occasion,FALSE,I enjoy working in a team and learning from others.,,,
ELEGANCE,The quality of being graceful and stylish in appearance or manner,FALSE,There is an elegance in the simplicity of a good plan.,,,
PELLUCID,Lucid in style or meaning; easily understood,FALSE,Her pellucid explanation cleared all my doubts.,,,
UNFATHOMABLE,Incapable of being fully explored or understood,FALSE,The depth of the ocean is unfathomable.,,,
TRADUCE,To speak badly of or tell lies about so as to damage their reputation,FALSE,I will not traduce my rival to win the election.,,,
TEMPORAL,Relating to worldly as opposed to spiritual affairs; secular,FALSE,I am not concerned with the temporal and worldly pleasures.,,,
DENY,To state that one refuses to admit the truth of something,FALSE,I deny myself comfort to achieve my long-term goals.,,,
DISAGREE,To have or express a different opinion,FALSE,I can disagree with someone's opinion respectfully.,,,
PROSAIC,Having the style or diction of prose; lacking poetic beauty; dull,FALSE,I do not lead a prosaic and boring life.,,,
UNRAVEL,To investigate and solve or explain a mystery,FALSE,The detective tried to unravel the mystery of the murder.,,,
VISIT,To go to see and spend time with someone socially,FALSE,I visit my family during my leave.,,,
CHANGE,To make or become different,FALSE,I am the change I want to see in my team.,,,
PUNCTILIOUS,Showing great attention to detail or correct behavior,FALSE,I am punctilious in observing the rules of etiquette.,,,
TELL,To communicate information to someone in spoken or written words,FALSE,I tell the truth even if it is difficult.,,,
PREDATORY,Seeking to exploit or oppress others,FALSE,I will protect the weak from predatory elements.,,,
EVACUATE,To remove someone from a place of danger to a safer place,FALSE,I am trained in evacuating casualties from a conflict zone.,,,
MELANCHOLY,A feeling of pensive sadness typically with no obvious cause,FALSE,I overcome melancholy by engaging in my hobbies.,,,
HOME,The place where one lives permanently,FALSE,My unit is my second home and a great family to me.,,,
REGIMENT,A permanent unit of an army typically commanded by a colonel,FALSE,It will be an honor to serve in any regiment.,,,
CHALLENGE,A task or situation that tests someone's abilities,FALSE,I embrace challenges as they help me to grow as a person.,,,
CONVICTION,A firmly held belief or opinion,FALSE,I speak with conviction and act with determination.,,,
INCESSANT,Continuing without pause or interruption,FALSE,I have an incessant desire to learn and grow.,,,
MAUDLIN,Self-pityingly or tearfully sentimental,FALSE,I am not a maudlin person; I am emotionally strong.,,,
TREPIDATION,A feeling of fear or agitation about something that may happen,FALSE,I have no trepidation about facing the SSB interview.,,,
ZEAL,Great energy or enthusiasm in pursuit of a cause or an objective,FALSE,I approach every task with great zeal and enthusiasm.,,,
GUTS,Personal courage and determination,FALSE,It takes guts to stand for what is right and just.,,,
UNPRECEDENTED,Never done or known before,FALSE,The company has achieved an unprecedented growth this year.,,,
TRANSMUTE,To change in form nature or substance,FALSE,A good leader can transmute a group of individuals into a team.,,,
INDIGENOUS,Originating or occurring naturally in a particular place; native,FALSE,I am proud of our indigenous defence technology.,,,
CALL,A cry or shout to attract attention,FALSE,I answer the call of duty without any hesitation.,,,
FILL,To put someone or something into a container to make it full,FALSE,I fill my free time with learning new skills.,,,
LACONIC,Using very few words,FALSE,I can be laconic and precise in my communication.,,,
RETRIBUTION,Punishment inflicted on someone as vengeance for a wrong act,FALSE,The criminals will have to face a just retribution.,,,
READY,In a suitable state for an action or situation,FALSE,I am always ready to take on new responsibilities.,,,
TEAM,A group of people working together for a goal,FALSE,I believe a coordinated team can overcome any challenge.,,,
DESIGN,To plan or fashion artistically or skillfully,FALSE,I can design a simple and effective plan of action.,,,
INSURMOUNTABLE,Too great to be overcome,FALSE,No obstacle is insurmountable if you have the will.,,,
INVOKE,To cite or appeal to someone or something as an authority for an action,FALSE,I invoke the blessings of the almighty before a task.,,,
JUBILATION,A feeling of great happiness and triumph,FALSE,The victory was followed by a great jubilation.,,,
THINK,To have a particular opinion belief or idea,FALSE,I think clearly under pressure to find the most effective solutions.,,,
SLOTH,Reluctance to work or make an effort; laziness,FALSE,Sloth is the mother of all vices.,,,
ORDINANCE,An authoritative order; a decree,FALSE,An ordinance has the same force as an act of parliament.,,,
PENURY,Extreme poverty; destitution,FALSE,Hard work and education can lift a family out of penury.,,,
DISRUPT,To interrupt an event activity or process by causing a disturbance,FALSE,I can disrupt the enemy's plans with a surprise move.,,,
OBSEQUIOUS,Obedient or attentive to an excessive degree,FALSE,I am not obsequious; I have self-respect.,,,
INNOCUOUS,Not harmful or offensive,FALSE,A seemingly innocuous object can be dangerous.,,,
SUCCEED,To achieve the desired aim or result,FALSE,I am confident that I will succeed in my-mission.,,,
JUXTAPOSE,To place or deal with close together for contrasting effect,FALSE,I can juxtapose different ideas to create a new one.,,,
DEVOID,Entirely lacking or free from,FALSE,My decisions are devoid of any personal prejudice.,,,
INFLUENCE,The capacity to have an effect on the character development or behavior of someone,FALSE,I can influence people positively to work towards a common goal.,,,
COUNTER,To speak or act in opposition to,FALSE,I am trained in counter-insurgency operations.,,,
OBLITERATE,To destroy utterly; wipe out,FALSE,I will obliterate any threat to my country.,,,
OPTIMAL,Best or most favorable; optimum,FALSE,I strive for an optimal use of my resources.,,,
MALEVOLENT,Having or showing a wish to do evil to others,FALSE,I have no malevolent intentions towards anyone.,,,
VIVID,Producing powerful feelings or strong clear images in the mind,FALSE,I have a vivid memory of my childhood.,,,
CRISIS,A time of intense difficulty or danger,FALSE,I remain calm and composed during a crisis.,,,
WHY,For what reason or purpose,FALSE,I know my 'why' which gives me the strength to endure any 'how'.,,,
TEMPESTUOUS,Characterized by strong and turbulent or conflicting emotion,FALSE,She had a tempestuous relationship with her husband.,,,
SUSCEPTIBLE,Likely or liable to be influenced or harmed by a particular thing,FALSE,Young children are susceptible to infections.,,,
CONVENTION,A way in which something is usually done,FALSE,I respect the conventions and traditions of the armed forces.,,,
VERACITY,Conformity to facts; accuracy,FALSE,I have no doubt about the veracity of his statement.,,,
CONSEQUENCE,A result or effect of an action or condition,FALSE,I am prepared to face the consequences of my decisions.,,,
PRECEPT,A general rule intended to regulate behavior or thought,FALSE,I follow the precepts of my religion and my country's law.,,,
MAJESTIC,Having or showing impressive beauty or dignity,FALSE,The majestic Himalayas are a sight to behold.,,,
SUFFER,To experience or be subjected to something bad or unpleasant,FALSE,I can suffer hardships to achieve a greater purpose.,,,
IRREPROACHABLE,Beyond criticism; faultless,FALSE,An officer's conduct must be irreproachable.,,,
SUBLIME,Of such excellence or beauty as to inspire great admiration,FALSE,The view from the top of the mountain was sublime.,,,
VICTORY,An act of defeating an enemy or opponent in a battle,FALSE,Victory is achieved through flawless planning and execution.,,,
RELAX,To make or become less tense or anxious,FALSE,I relax by reading books and listening to music.,,,
GREED,Intense and selfish desire for something; especially wealth,FALSE,I am free from greed and material temptations.,,,
LABYRINTH,A complicated irregular network of passages or paths; a maze,FALSE,I can navigate through the labyrinth of life with a clear goal.,,,
SYLLOGISM,A form of reasoning in which a conclusion is drawn from two given propositions,FALSE,A syllogism is a form of logical reasoning.,,,
TANTAMOUNT,Equivalent in seriousness to; virtually the same as,FALSE,His silence was tantamount to an admission of guilt.,,,
LEARN,To gain or acquire knowledge of or skill in something,FALSE,I learn something new every day from my experiences.,,,
CULTIVATE,To try to acquire or develop a quality or skill,FALSE,I cultivate good habits like discipline and punctuality.,,,
UNFETTERED,Unrestrained or uninhibited,FALSE,I believe in the unfettered freedom of speech.,,,
CONSULT,To seek information or advice from someone,FALSE,I consult with my seniors and experts when needed.,,,
SUPERSEDE,To take the place of a person or thing previously in authority or use,FALSE,The new law will supersede the old one.,,,
STALWART,Loyal reliable and hardworking,FALSE,He is a stalwart of the party.,,,
DESIRABLE,Wished for as being an attractive or pleasing thing,FALSE,It is desirable for an officer to be physically fit.,,,
SYMBIOSIS,Interaction between two different organisms living in close physical association,FALSE,There is a symbiosis between the industry and the academia.,,,
MORIBUND,At the point of death; in terminal decline,FALSE,A unit with low morale is a moribund unit.,,,
IDEA,A thought or suggestion as to a possible course of action,FALSE,I welcome new ideas from all members of my team.,,,
VISION,The faculty or state of being able to see,FALSE,I have a clear vision for my future and I am working towards it.,,,
SPURIOUS,Not being what it purports to be; false or fake,FALSE,The market is full of spurious and fake products.,,,
MAKE,To form something by putting parts together or combining substances,FALSE,I make a positive impact on the people around me.,,,
INVOLVE,To have or include something as a necessary part,FALSE,I involve all team members in the planning process.,,,
DESCRIBE,To give a detailed account in words of someone or something,FALSE,I can describe a situation clearly and concisely.,,,
EVOKE,To bring or recall a feeling memory or image to the conscious mind,FALSE,The national anthem evokes a strong sense of patriotism in me.,,,
COORDINATE,To bring the different elements of a complex activity into a harmonious relationship,FALSE,I can coordinate the actions of different groups for a common aim.,,,
MAN,An adult male human being,FALSE,An officer is a man of his word.,,,
VACUOUS,Having or showing a lack of thought or intelligence; mindless,FALSE,She had a vacuous and empty look on her face.,,,
PLACE,A particular position or point in space,FALSE,I keep my belongings in their proper place.,,,
ACHIEVEMENT,I celebrate every achievement as a milestone towards greater goals and responsibilities.,FALSE,A thing done successfully,courage,or skill.,
ADAPTABILITY,My adaptability allows me to thrive in new and challenging environments quickly.,FALSE,The quality of being able to adjust to new conditions.,,,
ADVENTURE,I embrace adventure as an opportunity for growth learning and self-discovery always.,FALSE,An unusual and exciting or daring experience.,,,
AFFIRMATION,I use positive affirmation to build self-confidence and maintain a strong mindset.,FALSE,Emotional support or encouragement.,,,
ALERTNESS,My alertness helps me anticipate challenges and react swiftly and effectively always.,FALSE,The state of being watchful and prompt to meet danger or emergency.,,,
AMBITION,My ambition drives me to strive for excellence in all my endeavors consistently.,FALSE,A strong desire and determination to succeed.,,,
APPRECIATE,I appreciate the efforts of my team members and acknowledge their contributions publicly.,FALSE,Recognize the full worth of.,,,
ASSERTIVE,I am assertive in expressing my views while respecting the opinions of others.,FALSE,Having or showing a confident and forceful personality.,,,
ASSURANCE,I provide assurance to my team through clear communication and confident leadership styles.,FALSE,A positive declaration intended to give confidence; a promise.,,,
AUTHENTICITY,I value authenticity in myself and others fostering trust and genuine connections truly.,FALSE,The quality of being real or true.,,,
BENEVOLENCE,I practice benevolence by helping others and contributing to a positive work environment.,FALSE,The quality of being well meaning; kindness.,,,
BLISS,I find bliss in dedicated service and the successful completion of challenging tasks.,FALSE,Perfect happiness; great joy.,,,
BOLDNESS,My boldness in taking calculated risks often leads to innovative solutions and progress.,FALSE,Willingness to take risks and act innovatively; confidence or courage.,,,
BRIGHTNESS,I maintain a brightness of spirit that uplifts my team during tough times.,FALSE,The quality or state of giving out or reflecting light.,,,
BRILLIANCE,I aim for brilliance in planning and execution of all assigned duties effectively.,FALSE,Exceptional talent or intelligence.,,,
CALMNESS,My calmness under pressure ensures rational decision-making and effective crisis management always.,FALSE,The state or quality of being free from agitation or disturbance.,,,
CAMARADERIE,I foster camaraderie within my team to build strong bonds and enhance cooperation.,FALSE,Mutual trust and friendship among people who spend a lot of time together.,,,
CANDOR,I appreciate candor in communication as it builds trust and fosters transparency clearly.,FALSE,The quality of being open and honest in expression; frankness.,,,
CAPABILITY,I continuously enhance my capability to handle diverse and complex responsibilities effectively well.,FALSE,The power or ability to do something.,,,
CELEBRATE,I celebrate team successes to boost morale and acknowledge collective hard work appropriately.,FALSE,Acknowledge a significant or happy day or event with a social gathering or enjoyable activity.,,,
CHARITY,I believe in charity and contribute to societal welfare in meaningful ways always.,FALSE,The voluntary giving of help,to those in need.,,
CHARM,My positive charm helps in building rapport and fostering collaborative working relationships daily.,FALSE,The power or quality of delighting,or fascinating others.,,
CLARITY,I ensure clarity in my instructions to avoid misunderstandings and achieve objectives smoothly.,FALSE,The quality of being coherent and intelligible.,,,
CLEANLINESS,I maintain cleanliness in my personal space and workspace for discipline and hygiene.,FALSE,The state or quality of being clean or being kept clean.,,,
COMMEND,I commend good work promptly to motivate team members and encourage high performance.,FALSE,Praise formally or officially.,,,
COMMITMENT,My commitment to duty guides my actions and decisions at all times fully.,FALSE,The state or quality of being dedicated to a cause,etc.,,
COMPASSION,I show compassion towards my team members understanding their challenges and providing support.,FALSE,Sympathetic pity and concern for the sufferings or misfortunes of others.,,,
COMPETENCE,I strive for unwavering competence in all professional aspects through continuous learning diligently.,FALSE,The ability to do something successfully or efficiently.,,,
CONFIDENCE,My confidence in my abilities allows me to tackle challenges with determination effectively.,FALSE,The feeling or belief that one can rely on someone or something; firm trust.,,,
CONGRATULATE,I congratulate individuals for their achievements recognizing their hard work and dedication sincerely.,FALSE,Give someone good wishes when something special or pleasant has happened to them.,,,
CONSCIENCE,My conscience guides me to make ethical choices and uphold moral principles firmly.,FALSE,An inner feeling or voice viewed as acting as a guide to the rightness or wrongness of one's behavior.,,,
CONSISTENCY,I value consistency in performance as it builds reliability and trust over time.,FALSE,Consistent behavior or treatment.,,,
CONTENTMENT,I find contentment in doing my best and contributing meaningfully to my organization fully.,FALSE,A state of happiness and satisfaction.,,,
COOPERATION,I foster cooperation among team members to achieve common goals effectively and harmoniously.,FALSE,The process of working together to the same end.,,,
COURAGE,My courage helps me to take righteous stands and make firm decisions always.,FALSE,The ability to do something that frightens one; bravery.,,,
COURTESY,I practice courtesy in all my interactions building respect and positive relations professionally.,FALSE,The showing of politeness in one's attitude and behavior towards others.,,,
CREATIVITY,I encourage creativity within my team to find innovative solutions for problems easily.,FALSE,The use of imagination or original ideas,,,
CREDIBILITY,I build credibility through consistent performance and upholding ethical standards transparently clearly.,FALSE,The quality of being trusted and believed in.,,,
DEDICATION,My dedication to service motivates me to perform my duties with utmost sincerity always.,FALSE,The quality of being committed to a task or purpose.,,,
DELIGHT,I take delight in mentoring my juniors and watching them grow professionally today.,FALSE,Great pleasure.,,,
DEPENDABILITY,I ensure my dependability by consistently fulfilling my responsibilities reliably on time always.,FALSE,The quality of being trustworthy and reliable.,,,
DESIRE,My strong desire to serve the nation drives my pursuit of excellence determinedly.,FALSE,A strong feeling of wanting to have something or wishing for something to happen.,,,
DETERMINATION,My determination helps me overcome obstacles and achieve even difficult goals resolutely powerfully.,FALSE,The quality of being firmly resolved to do something.,,,
DEVOTION,My devotion to my country and its values is unwavering and absolute always.,FALSE,Love,or enthusiasm for a person,activity,or cause.
DIGNITY,I uphold the dignity of every individual irrespective of rank or position fairly.,FALSE,The state or quality of being worthy of honor or respect.,,,
DILIGENCE,My diligence in work ensures thoroughness and high-quality outcomes in all tasks.,FALSE,Careful and persistent work or effort.,,,
DISCOVERY,I embrace discovery as a means to expand knowledge and find new solutions.,FALSE,The action or process of discovering or being discovered.,,,
EARNESTNESS,My earnestness in pursuing tasks ensures they are completed with sincerity and dedication.,FALSE,Sincere and intense conviction.,,,
EASE,I approach complex tasks with a calm mind which brings ease in finding solutions.,FALSE,Absence of difficulty or effort.,,,
EFFECTIVENESS,I strive for effectiveness in all actions ensuring optimal use of resources timely.,FALSE,The degree to which something is successful in producing a desired result.,,,
EFFICIENCY,I focus on efficiency to maximize output and conserve valuable team resources properly.,FALSE,The state or quality of being efficient.,,,
ELEGANCE,I appreciate elegance in thought and action reflecting refined and effective approaches keenly.,FALSE,The quality of being graceful and stylish in appearance or manner.,,,
EMPATHY,I practice empathy to understand my team's perspectives and build stronger connections now.,FALSE,The ability to understand and share the feelings of another.,,,
ENABLE,I strive to enable my team members to achieve their full potential always.,FALSE,Give (someone or something) the authority or means to do something.,,,
ENCOURAGE,I encourage my team to take initiative and propose innovative solutions actively freely.,FALSE,Give support,or hope to (someone).,,
ENDURANCE,My physical and mental endurance helps me perform optimally under sustained pressure conditions.,FALSE,The fact or power of enduring an unpleasant or difficult process or situation without giving way.,,,
ENERGY,I maintain high energy levels to inspire my team and tackle challenges vigorously effectively.,FALSE,The strength and vitality required for sustained physical or mental activity.,,,
ENGAGE,I engage actively with my team to foster open communication and collaboration swiftly.,FALSE,Occupy,or involve (someone's interest or attention).,,
ENLIGHTEN,I seek to enlighten myself and others through continuous learning and knowledge sharing.,FALSE,Give (someone) greater knowledge and understanding about a subject or situation.,,,
ENTHUSIASM,My enthusiasm for new projects motivates the entire team to perform their best.,FALSE,Intense and eager enjoyment,or approval.,,
EQUALITY,I believe in equality and treat every individual with fairness and respect justly.,FALSE,The state of being equal,rights,and opportunities.,
EXCELLENCE,I pursue excellence in every task I undertake setting high standards for myself.,FALSE,The quality of being outstanding or extremely good.,,,
EXCITEMENT,I channel my excitement for new challenges into productive and focused efforts fully.,FALSE,A feeling of great enthusiasm and eagerness.,,,
FAIRNESS,I uphold fairness in all my decisions and interactions within the team justly.,FALSE,Impartial and just treatment or behavior without favoritism or discrimination.,,,
FAITHFULNESS,My faithfulness to my duties and my organization is unwavering and strong always.,FALSE,The quality of being loyal.,,,
FAVOR,I work hard to earn favor through merit not through any unfair means.,FALSE,Approval,or liking for someone or something.,,
FELLOWSHIP,I value the fellowship within my unit promoting mutual support and strong bonds.,FALSE,Friendly association,,,
FERVOR,I approach my responsibilities with fervor and a deep sense of commitment properly.,FALSE,Intense and passionate feeling.,,,
FINESSE,I handle delicate situations with finesse ensuring positive and diplomatic outcomes professionally carefully.,FALSE,Intricate and refined delicacy.,,,
FLOURISH,I create an environment where my team members can flourish and achieve potential.,FALSE,Grow or develop in a healthy or vigorous way.,,,
FORBEARANCE,I practice forbearance when faced with provocation maintaining composure and professionalism thoughtfully daily.,FALSE,Patient self-control; restraint and tolerance.,,,
FORESIGHT,My foresight helps in anticipating future challenges and preparing effective mitigation strategies proactively.,FALSE,The ability to predict or the action of predicting what will happen or be needed in the future.,,,
FORGIVENESS,I believe in forgiveness for honest mistakes coupled with learning and improvement always.,FALSE,The action or process of forgiving or being forgiven.,,,
FORTITUDE,I face adversity with fortitude and an unwavering resolve to overcome challenges bravely.,FALSE,Courage in pain or adversity.,,,
FREEDOM,I uphold the freedom of our nation through disciplined service and unwavering vigilance.,FALSE,The power or right to act,or think as one wants without hindrances.,,
FRIENDLINESS,My friendliness helps in building rapport and creating a positive team atmosphere conducive.,FALSE,The quality of being friendly.,,,
FULFILLMENT,I find deep fulfillment in serving my country and contributing to its security.,FALSE,The achievement of something desired,or predicted.,,
GENEROSITY,I practice generosity by sharing my knowledge and supporting colleagues in their growth.,FALSE,The quality of being kind and generous.,,,
GENIUS,I admire genius but believe consistent hard work is key to sustained success.,FALSE,Exceptional intellectual or creative power or other natural ability.,,,
GENTLENESS,I employ gentleness combined with firmness when guiding and mentoring my subordinates effectively.,FALSE,The quality of being kind,or mild-mannered.,,
