word,best_response,shown,meaning,,,
VERISIMILITUDE,The appearance of being true or real,FALSE,The movie had a remarkable verisimilitude to real life.,,,
TYRO,A beginner or novice,FALSE,As a tyro in the army I have a lot to learn.,,,
SETTLE,To resolve or reach an agreement about an argument or problem,FALSE,I settle for nothing but the best.,,,
UNWONTED,Unaccustomed or unusual,FALSE,He showed an unwonted interest in classical music.,,,
PIQUANT,Having a pleasantly sharp taste or appetizing flavor,FALSE,The debate became piquant with the entry of the new speaker.,,,
INTOXICATE,To cause someone to lose control of their faculties or behavior; to excite,FALSE,Success should not intoxicate a person.,,,
NIGHT,The period of darkness in each twenty-four hours,FALSE,I am well trained to operate efficiently during day and night.,,,
TANTRUM,An uncontrolled outburst of anger and frustration,FALSE,The child threw a tantrum when his demand was not met.,,,
KEN,One's range of knowledge or sight,FALSE,The complexities of geopolitics are beyond the ken of a common man.,,,
HARD,Difficult to accomplish or understand,FALSE,I overcome hard situations with perseverance and clear thinking.,,,
ENTRENCHED,Firmly established and difficult to change,FALSE,I can break through an entrenched enemy defence.,,,
BUILD,To construct something by putting parts or materials together,FALSE,I build strong relationships with my peers and subordinates.,,,
PUNISHMENT,The infliction or imposition of a penalty as retribution,FALSE,Discipline is better than punishment.,,,
SOLILOQUY,An act of speaking one's thoughts aloud when by oneself,FALSE,Hamlet's soliloquy is a masterpiece of English literature.,,,
IMAGINATION,The faculty or action of forming new ideas or images,FALSE,I use my imagination to visualize success and plan for it.,,,
PENURIOUS,Extremely poor; poverty-stricken,FALSE,I have never been in a penurious condition.,,,
HALF,Either of two equal parts into which something is or can be divided,FALSE,I never leave a task half-done.,,,
UNSCATHED,Without suffering any injury damage or harm,FALSE,He came out unscathed from the accident.,,,
WISDOM,The quality of having experience knowledge and good judgment,FALSE,I gain wisdom from my experiences and learn from my mistakes.,,,
QUIBBLE,To argue or raise objections about a trivial matter,FALSE,I do not quibble over trivial matters.,,,
TREACLY,Overly sentimental,FALSE,I do not like treacly and sentimental movies.,,,
DIVERSE,Showing a great deal of variety; very different,FALSE,I respect and value diverse perspectives and opinions.,,,
TOUGH,Strong enough to withstand adverse conditions or rough handling,FALSE,I am mentally tough and can withstand extreme pressure.,,,
IGNORE,To refuse to take notice of or acknowledge,FALSE,I ignore distractions and stay focused on my goal.,,,
SINCERE,Free from pretense or deceit; proceeding from genuine feelings,FALSE,I am sincere in my intentions and actions.,,,
HOMAGE,Special honor or respect shown publicly,FALSE,I pay homage to the martyrs who laid down their lives for us.,,,
PERIPATETIC,Traveling from place to place especially working in various places for relatively short periods,FALSE,I enjoy a peripatetic life.,,,
MIND,The element of a person that enables awareness and thought,FALSE,I maintain a calm mind even under the most extreme pressure.,,,
IDEOLOGY,A system of ideas and ideals especially one which forms the basis of economic or political theory,FALSE,My ideology is based on nationalism and humanism.,,,
SAVOR,To taste good food or drink and enjoy it completely,FALSE,I savor every moment of my life.,,,
CAUTION,Care taken to avoid danger or mistakes,FALSE,I exercise caution in dangerous situations.,,,
REPROVE,To reprimand or censure someone,FALSE,The teacher reproved the student for his mischief.,,,
LIBEL,A published false statement that is damaging to a person's reputation,FALSE,I will never indulge in libel against anyone.,,,
KNOW,To have knowledge or information about something,FALSE,I know my strengths and weaknesses and I work on them.,,,
LAUDABLE,Deserving praise and commendation,FALSE,His service to the nation is laudable.,,,
REPEAT,To say again something that has already been said,FALSE,I repeat a task until I achieve perfection.,,,
INCREDIBLE,Impossible to believe,FALSE,The courage of our soldiers is incredible.,,,
HONOR,High respect; great esteem,FALSE,I will always uphold the honor of my family and my nation.,,,
ADVERSITY,Difficulties; misfortune,FALSE,I thrive in adversity and grow stronger.,,,
COVERT,Not openly acknowledged or displayed,FALSE,Covert operations require special skills and courage.,,,
SOUND,Based on reason sense or judgment; robust,FALSE,I make sound judgements based on careful analysis.,,,
FERVENT,Having or displaying a passionate intensity,FALSE,I have a fervent desire to serve my country.,,,
OPPROBRIUM,Harsh criticism or censure,FALSE,A traitor has to face the opprobrium of his countrymen.,,,
PROTRUDE,To extend beyond or above a surface,FALSE,A nail was protruding from the wall.,,,
COMPASSION,Sympathetic pity and concern for the sufferings of others,FALSE,A leader must have compassion for his men.,,,
PEREGRINATION,A journey especially a long or meandering one,FALSE,My job will involve a lot of peregrination.,,,
ENTHUSIASM,Intense and eager enjoyment interest or approval,FALSE,My enthusiasm for my work is infectious.,,,
INFURIATE,To make someone extremely angry and impatient,FALSE,I remain calm even when someone tries to infuriate me.,,,
RETINUE,A group of advisers or assistants accompanying an important person,FALSE,The king arrived with his retinue of courtiers.,,,
SEMBLANCE,The outward appearance or apparent form of something,FALSE,I tried to maintain a semblance of calm on my face.,,,
CONTINGENCY,A future event or circumstance which is possible but cannot be predicted with certainty,FALSE,I always have a contingency plan for my missions.,,,
MISS,To fail to hit or catch something aimed at,FALSE,I never miss an opportunity to prove my worth.,,,
EXULT,To show or feel elation or jubilation especially as the result of a success,FALSE,I will exult in my victory but remain humble.,,,
INNATE,Inborn; natural,FALSE,Leadership is an innate quality that can be developed.,,,
LAVISH,Sumptuously rich elaborate or luxurious,FALSE,I do not lead a lavish lifestyle.,,,
MASTERY,Comprehensive knowledge or skill in a subject,FALSE,I want to achieve mastery in my field.,,,
ENTICE,To attract or tempt by offering pleasure or advantage,FALSE,I am not enticed by material pleasures.,,,
PRETENTIOUS,Attempting to impress by affecting greater importance than is actually possessed,FALSE,I am not pretentious; I am a down-to-earth person.,,,
DEFEND,To resist an attack made on someone or something,FALSE,I am sworn to defend the constitution of my country.,,,
LUCID,Expressed clearly; easy to understand,FALSE,I can explain my ideas in a lucid manner.,,,
UNCANNY,Strange or mysterious especially in an unsettling way,FALSE,He has an uncanny ability to predict the future.,,,
PERSISTENT,Continuing firmly in a course of action in spite of difficulty,FALSE,I am persistent in my efforts and I never give up.,,,
VOLUMINOUS,Occupying or containing much space; large in volume,FALSE,I had to read a voluminous report on the project.,,,
PREDILECTION,A preference or special liking for something,FALSE,I have a predilection for outdoor sports.,,,
SQUALID,Extremely dirty and unpleasant especially as a result of poverty or neglect,FALSE,The refugees were living in squalid conditions.,,,
EXPECT,To regard something as likely to happen,FALSE,I expect the best from myself and I work for it.,,,
CONTAIN,To have or hold someone or something within,FALSE,I can contain a difficult situation from escalating.,,,
SERAPHIC,Characteristic of or resembling a seraph or seraphim; angelic,FALSE,The baby had a seraphic smile on its face.,,,
FIRM,Strongly felt and unlikely to change,FALSE,I make firm decisions after analyzing all the available facts.,,,
INTERJECT,To say something abruptly especially as an aside or interruption,FALSE,I interject in a discussion only to add value.,,,
RIBALD,Referring to sexual matters in an amusingly rude or irreverent way,FALSE,I do not enjoy ribald jokes.,,,
REQUEST,An act of asking politely or formally for something,FALSE,I request for help when I am in doubt.,,,
ENDEAVOR,To try hard to do or achieve something,FALSE,I will always endeavor to do my best for my country.,,,
SLEEP,A condition of body and mind that reoccurs for several hours,FALSE,Adequate sleep is very necessary for a sharp and active mind.,,,
FACILITATE,To make an action or process easy or easier,FALSE,As a leader I will facilitate the work of my team.,,,
INDEPENDENT,Free from outside control; not depending on another's authority,FALSE,I am an independent thinker but also a good team player.,,,
PANACEA,A solution or remedy for all difficulties or diseases,FALSE,There is no panacea for all the problems of the world.,,,
CHECK,To examine something in order to determine its accuracy,FALSE,I check my equipment before starting any important task.,,,
MALLEABLE,Easily influenced; pliable,FALSE,My personality is malleable and I can adapt to any situation.,,,
ESCAPE,To break free from confinement or control,FALSE,I face problems head-on instead of trying to escape from them.,,,
SURVIVE,To continue to live or exist especially in spite of danger,FALSE,I have the mental fortitude to survive in extreme conditions.,,,
PROFUSE,Plentiful; abundant,FALSE,I thanked him profusely for his help.,,,
VICISSITUDE,A change of circumstances or fortune typically one that is unwelcome,FALSE,I am prepared for the vicissitudes of life.,,,
RECTIFY,To put something right; correct,FALSE,I will rectify my mistake and learn from it.,,,
EMPOWER,To give someone the authority or power to do something,FALSE,A good leader empowers his subordinates.,,,
TASK,A piece of work to be done or undertaken,FALSE,I approach every task with a positive and determined attitude.,,,
NEGLIGENT,Failing to take proper care in doing something,FALSE,I am never negligent in my duties.,,,
TEEM,To be full of or swarming with,FALSE,The river was teeming with fish.,,,
UNABLE,Lacking the skill power or means to do something,FALSE,If I am unable to do a task I seek help and learn.,,,
DIMINISH,To make or become less,FALSE,I never let my enthusiasm diminish.,,,
DRIVE,An innate urge to attain a goal,FALSE,I have the drive to succeed in any task I am given.,,,
SERENE,Calm peaceful and untroubled; tranquil,FALSE,I love the serene and calm environment of the countryside.,,,
FINE,Of high quality,FALSE,I am in fine physical and mental condition.,,,
VORACIOUS,Wanting or devouring great quantities of food; having a very eager approach,FALSE,He is a voracious reader.,,,
CLIMB,To go or come up a slope or staircase,FALSE,I am ready to climb any mountain to achieve my goals.,,,
LAND,The part of the earth's surface that is not covered by water,FALSE,I am ready to defend every inch of my motherland.,,,
TEMERITY,Excessive confidence or boldness; audacity,FALSE,He had the temerity to question the authority of his boss.,,,
PROVISIONAL,Arranged or existing for the present possibly to be changed later,FALSE,I have received a provisional appointment letter.,,,
FUSION,The process or result of joining two or more things together to form a single entity,FALSE,My personality is a fusion of modern and traditional values.,,,
SKEPTIC,A person inclined to question or doubt all accepted opinions,FALSE,I am a skeptic who does not believe everything I hear.,,,
VOUCHSAFE,To give or grant something to someone in a gracious manner,FALSE,He vouchsafed to me the secret of his success.,,,
REJUVENATE,To make someone or something look or feel younger fresher or more lively,FALSE,A good holiday can rejuvenate your body and mind.,,,
SYNCHRONOUS,Existing or occurring at the same time,FALSE,The synchronous movement of the soldiers in the parade was a treat to watch.,,,
GUIDANCE,Advice or information aimed at resolving a problem or difficulty,FALSE,I seek guidance from my seniors when in doubt.,,,
OR,Used to link alternatives,FALSE,I will do it or I will learn how to do it.,,,
EMBRACE,To hold someone closely in one's arms as a sign of affection,FALSE,I embrace challenges with a positive attitude.,,,
GRIT,Courage and resolve; strength of character,FALSE,I have the grit and determination to succeed.,,,
REPRISAL,An act of retaliation,FALSE,We should be ready for any reprisal from the enemy.,,,
SELF,A person's essential being that distinguishes them from others,FALSE,Self-discipline is the foundation of my character.,,,
TOWN,A built-up area with a name defined boundaries and local government,FALSE,I contribute to the welfare of my town.,,,
SACRIFICE,An act of giving up something valued for the sake of something else,FALSE,I am ready to make any sacrifice for my country.,,,
SARTORIAL,Relating to tailoring clothes or style of dress,FALSE,He is known for his sartorial elegance.,,,
PARIAH,An outcast,FALSE,A traitor is treated like a pariah by his own people.,,,
MAP,A diagrammatic representation of an area of land or sea,FALSE,I can read a map and navigate in unknown terrain.,,,
LOT,A large number or amount; a great deal,FALSE,I have a lot of respect for my elders and teachers.,,,
PHLEGMATIC,Having an unemotional and stolidly calm disposition,FALSE,I have a phlegmatic temperament and do not get easily excited.,,,
FOSTER,To encourage the development of something,FALSE,I foster a spirit of camaraderie and teamwork.,,,
MANAGE,To be in charge of a company organization or group,FALSE,I can manage my time and resources effectively.,,,
MIASMA,An oppressive or unpleasant atmosphere,FALSE,I do not let the miasma of negativity affect me.,,,
DETER,To discourage someone from doing something by instilling doubt or fear,FALSE,A strong defence can deter any aggression from the enemy.,,,
MUNIFICENT,Larger or more generous than is usual or necessary,FALSE,A good leader should be munificent in his praise.,,,
SYNOPTIC,Of or forming a general summary or synopsis,FALSE,A synoptic view of the situation is necessary for a good decision.,,,
LEGACY,An amount of money or property left to someone in a will,FALSE,I want to leave a legacy of courage and honor.,,,
STACCATO,With each sound or note sharply detached from the others,FALSE,The staccato sound of the machine gun was deafening.,,,
SO,For that reason; therefore,FALSE,I am focused so I can achieve my targets.,,,
NEBULOUS,In the form of a cloud or haze; hazy; vague,FALSE,I do not have nebulous ideas; my goals are clear.,,,
EVALUATE,To form an idea of the amount number or value of; assess,FALSE,I evaluate my strengths and weaknesses objectively.,,,
SLANDER,The action or crime of making a false spoken statement damaging to a person's reputation,FALSE,I will sue him for slander.,,,
AUTHORITY,The power or right to give orders and make decisions,FALSE,I respect authority and follow the chain of command.,,,
EXPLAIN,To make an idea situation or problem clear to someone,FALSE,I can explain complex ideas in a simple and clear manner.,,,
EQUILIBRIUM,A state in which opposing forces or influences are balanced,FALSE,I maintain my equilibrium in stressful situations.,,,
POIGNANT,Evoking a keen sense of sadness or regret,FALSE,The movie had a poignant ending.,,,
COLLABORATE,To work jointly on an activity or project,FALSE,I collaborate with others to achieve the best results.,,,
LADY,A woman of good social position,FALSE,Lady officers have proven their mettle in the armed forces.,,,
MADE,Past tense of make,FALSE,I have made up my mind to become an officer.,,,
GATHER,To come together; assemble or accumulate,FALSE,I gather all relevant information before making a decision.,,,
ENTANGLE,To cause to become twisted together with or caught in,FALSE,I do not get entangled in petty politics.,,,
TALL,Of great or more than average height,FALSE,I stand tall in the face of adversity.,,,
PARITY,The state or condition of being equal especially regarding status or pay,FALSE,There should be a parity in the treatment of all individuals.,,,
COMPLAIN,To express dissatisfaction or annoyance about something,FALSE,I focus on solutions rather than complaining about problems.,,,
INGENIOUS,Clever original and inventive,FALSE,An ingenious plan can surprise the enemy.,,,
FAT,A natural oily substance occurring in animal bodies,FALSE,I maintain my body fat percentage through regular exercise.,,,
VORTEX,A mass of whirling fluid or air,FALSE,The ship was caught in a vortex and sank.,,,
RATIFY,To sign or give formal consent to a treaty contract or agreement,FALSE,The treaty was ratified by the parliament.,,,
THOROUGH,Complete with regard to every detail,FALSE,I am thorough in my planning and preparation.,,,
CURIOSITY,A strong desire to know or learn something,FALSE,My curiosity drives me to learn and explore.,,,
CONSISTENCY,Consistent behavior or treatment,FALSE,Consistency in performance is the hallmark of a professional.,,,
PERVADE,To be present and apparent throughout,FALSE,A sense of discipline pervades the entire military cantonment.,,,
EXCLUDE,To deny someone access to or bar from a place group or privilege,FALSE,I never exclude anyone from my team.,,,
INNOVATE,To make changes in something established especially by introducing new methods,FALSE,I have the ability to innovate and find new solutions.,,,
SOLID,Firm and stable in shape; not liquid or fluid,FALSE,I have a solid foundation of knowledge and skills.,,,
SERENDIPITY,The occurrence of events by chance in a happy way,FALSE,Finding a ten-rupee note on the road was a serendipity.,,,
QUOTIDIAN,Of or occurring every day; daily,FALSE,I want to lead an adventurous life not a quotidian one.,,,
GREEN,The color of growing grass; relating to nature,FALSE,I help in keeping my surroundings green and clean.,,,
ODIUM,General or widespread hatred or disgust directed toward someone,FALSE,A corrupt official has to face the odium of the public.,,,
SURMOUNT,To overcome a difficulty or obstacle,FALSE,I can surmount any obstacle with my willpower.,,,
ENTHUSE,To make someone interested and excited,FALSE,I can enthuse my team with my passion and energy.,,,
CONFIDENCE,The feeling of self-assurance arising from one's appreciation of one's own abilities,FALSE,My confidence comes from my knowledge and preparation.,,,
ENDORSE,To declare one's public approval or support of,FALSE,I endorse a culture of merit and transparency.,,,
REPOSE,A state of rest sleep or tranquility,FALSE,I find repose in the lap of nature.,,,
WAGGISH,Humorous in a playful mischievous or facetious manner,FALSE,He made a waggish and humorous remark.,,,
ROCK,The solid mineral material forming part of the surface of the earth,FALSE,I am a rock of support for my team in difficult times.,,,
MAGNANIMOUS,Very generous or forgiving especially toward a rival or someone less powerful,FALSE,A great leader is always magnanimous in victory.,,,
INTERSPERSE,To scatter among or between other things,FALSE,My life is interspersed with work and play.,,,
WASTE,To use or expend carelessly extravagantly or to no purpose,FALSE,I do not waste time in unproductive activities.,,,
SUPPLANT,To supersede and replace,FALSE,He tried to supplant his boss to get the promotion.,,,
ONE,The lowest cardinal number,FALSE,One team one dream is my motto.,,,
TRANSPIRE,To occur; happen,FALSE,No one knows what transpired in the closed-door meeting.,,,
SECURE,Fixed or fastened so as to not give way; safe,FALSE,I feel secure in my abilities and my decisions.,,,
SEETHE,To be filled with intense but unexpressed anger,FALSE,I was seething with anger but I controlled myself.,,,
TACIT,Understood or implied without being stated,FALSE,There was a tacit understanding between us.,,,
SHOW,To allow or cause to be visible,FALSE,I show courage and initiative in adverse situations.,,,
STIPEND,A fixed regular sum paid as a salary or allowance,FALSE,I received a small stipend during my internship.,,,
BRAVE,Ready to face and endure danger or pain; courageous,FALSE,A brave soldier is a tremendous asset to the entire nation.,,,
DISDAIN,The feeling that someone or something is unworthy of one's consideration or respect,FALSE,I have disdain for people who are dishonest and lazy.,,,
UNDERSCORE,To emphasize the importance of something,FALSE,I want to underscore the importance of teamwork.,,,
LEVITY,The treatment of a serious matter with humor or in a manner lacking due respect,FALSE,I use levity to diffuse a tense situation.,,,
FABRICATE,To invent or concoct something typically with deceitful intent,FALSE,I will never fabricate a story to cover my mistakes.,,,
CONCERN,To relate to; be about; to worry someone,FALSE,The well-being of my men is my primary concern.,,,
SCRUTINIZE,To examine or inspect closely and thoroughly,FALSE,The committee will scrutinize all the applications.,,,
FULFILL,To bring to completion or reality; achieve or realize something desired,FALSE,I will fulfill my duties with honor and integrity.,,,
ENUNCIATE,To say or pronounce clearly,FALSE,I can enunciate my words clearly and confidently.,,,
JOY,A feeling of great pleasure and happiness,FALSE,I find joy in serving my nation and protecting its people.,,,
INSPIRE,To fill someone with the urge or ability to do something creative,FALSE,I want to inspire others through my actions and deeds.,,,
RUSH,To move with urgent haste,FALSE,I never rush into a decision without thinking.,,,
USURP,To take a position of power illegally or by force,FALSE,The general tried to usurp the power of the king.,,,
FORMULATE,To create or devise methodically,FALSE,I can formulate a winning strategy for my team.,,,
INITIATION,The action of beginning something,FALSE,The initiation into the armed forces is tough.,,,
SONG,A short poem or other set of words set to music or meant to be sung,FALSE,A patriotic song fills me with immense pride.,,,
KICK,To strike or propel forcibly with the foot,FALSE,I kick-start my day with a session of physical training.,,,
INFLAME,To provoke or intensify strong feelings especially anger,FALSE,I do not let passions inflame and cloud my judgement.,,,
IRONY,The expression of one's meaning by using language that normally signifies the opposite,FALSE,The irony of life is that we value things only when we lose them.,,,
SENSE,A faculty by which the body perceives an external stimulus,FALSE,My sense of duty is my guiding principle.,,,
PROVE,To demonstrate the truth or existence of something by evidence,FALSE,I will prove my worth through my actions.,,,
VULNERABLE,Susceptible to physical or emotional attack or harm,FALSE,The city was vulnerable to an enemy attack.,,,
SERIOUS,Demanding or characterized by careful consideration or application,FALSE,I am serious about my career goals and aspirations.,,,
PROVIDENT,Making or indicative of timely preparation for the future,FALSE,A provident person saves for his future.,,,
JUDGEMENT,The ability to make considered decisions or come to sensible conclusions,FALSE,I have a good sense of judgement which helps me in decision making.,,,
ESTEEM,Respect and admiration,FALSE,I hold my seniors and the traditions of the army in high esteem.,,,
FREE,Able to act or be done as one wishes; not under control of another,FALSE,I use my free time for hobbies and self-development.,,,
EXHAUSTED,Very tired; drained of one's physical or mental resources,FALSE,My strong willpower pushes me even when I am exhausted.,,,
VICARIOUS,Experienced in the imagination through the feelings or actions of another person,FALSE,I get a vicarious pleasure by reading adventure stories.,,,
REVIEW,A formal assessment of something with the intention of instituting change if necessary,FALSE,I review my performance to identify areas of improvement.,,,
FINISH,To bring a task or activity to an end,FALSE,I finish what I start with utmost sincerity.,,,
SHARP,Having a cutting edge or point; mentally quick,FALSE,I have a sharp mind and keen observation skills.,,,
PESSIMISM,A tendency to see the worst aspect of things or believe that the worst will happen,FALSE,Pessimism has no place in a soldier's dictionary.,,,
INIMICAL,Tending to obstruct or harm; unfriendly,FALSE,I am not inimical to anyone.,,,
ENIGMA,A person or thing that is mysterious puzzling or difficult to understand,FALSE,The complexity of human nature is an enigma.,,,
COURAGE,The ability to do something that frightens one; bravery,FALSE,I display courage when faced with daunting situations.,,,
EMERGE,To move out of or away from something and come into view,FALSE,I will emerge as a successful officer after my training.,,,
DEDUCE,To arrive at a fact or conclusion by reasoning,FALSE,I can deduce logical conclusions from given information.,,,
LATE,Doing something or taking place after the expected or usual time,FALSE,I am never late for any of my commitments.,,,
ENDURANCE,The fact or power of enduring an unpleasant or difficult process,FALSE,I have high mental and physical endurance.,,,
CREED,A system of religious belief; a faith,FALSE,I respect people of all creeds and religions.,,,
NURTURE,To care for and encourage the growth or development of,FALSE,I will nurture the young talent in my team.,,,
PROSELYTIZE,To attempt to convert someone from one religion or belief to another,FALSE,I do not try to proselytize anyone to my point of view.,,,
GRIEF,Deep sorrow especially that caused by someone's death,FALSE,I cope with grief by staying strong for my family and friends.,,,
ELOQUENT,Fluent or persuasive in speaking or writing,FALSE,An officer should be eloquent in his speech.,,,
BATTALION,A large body of troops ready for battle typically commanded by a lieutenant colonel,FALSE,A battalion's strength is the spirit of its men.,,,
